record_id,source,target_id,search_run_id,title,abstract_or_summary,year,journal_or_source,doi,pmid,url,raw_record_id,dedup_key,duplicate_of,is_duplicate
pubmed:37892697:pubmed_anticoag_refined_20260603T125913_ece52619,pubmed,anticoag_refined,pubmed_anticoag_refined_20260603T125913_ece52619,"Relationships, Current Issues, Safety and Efficacy of Oral Anticoagulation in Cancer Patients with Atrial Fibrillation.","A relationship between malignancy and impaired hemostasis has been proven, and balancing clotting and bleeding risks can be challenging. Half of cancer patients with atrial fibrillation (AF) do not receive any oral anticoagulation (OAC). Using PubMed on the relationship between cancer and AF and their association with hemostasis, targeting studies comparing vitamin K antagonists (VKAs) and direct OAC (DOAC) strategies in AF cancer patients, three RCTs (>3000 patients) and eight observational studies (>250,000 patients) comparing different OACs were retrieved. The VKA prescribed was always warfarin. Dabigatran was the only DOAC not analyzed in the RCTs but the most used in non-randomized studies, whereas edoxaban-treated patients were the majority in the RCTs. Overall, the DOAC patients showed similar or lower rates of efficacy (thromboembolic) and safety (bleeding) outcomes compared to the VKA patients. DOACs are subject to fewer interactions with antineoplastic agents. DOACs may be preferable to VKAs as a thromboembolic prophylaxis in cancer patients with non-valvular AF.",2023,Journal of clinical medicine,10.3390/jcm12206559,37892697,https://pubmed.ncbi.nlm.nih.gov/37892697/,37892697,doi:10.3390/jcm12206559,,false
pubmed:35261442:pubmed_anticoag_refined_20260603T125913_ece52619,pubmed,anticoag_refined,pubmed_anticoag_refined_20260603T125913_ece52619,Time in therapeutic range of anticoagulation among patients with atrial fibrillation and cerebral amyloid angiopathy.,"Atrial fibrillation (AF) and cerebral amyloid angiopathy (CAA) present risks of ischemic stroke and intracerebral hemorrhage (ICH). Vitamin K antagonist use is associated with fluctuations in international normalized ratio (INR), which predispose to a higher bleeding risk. Patients with a diagnosis of AF and ICH while on a vitamin K antagonist were identified using the Rochester Epidemiology Project. Sixty patients were identified (mean age 81.3 years; 24 men). Thirty-three (55%) exhibited characteristics consistent with possible (n = 25) or probable (n = 8) CAA. Mean time in therapeutic range in the 30 days preceding ICH was 55.4%, with no difference between CAA and non-CAA patients. Mean time spent above therapeutic range (INR > 3.0) was 17.7%, with no difference between CAA and non-CAA patients. Following ICH, 21 (35%) died within 30 days, with total mortality at 76.7% after 176.4 person-years of follow-up (mean 2.9 years). Time in therapeutic range in the 30 days prior to ICH had no significant impact on 7-day mortality, nor risk of recurrent ICH or ischemic stroke. Patients with warfarin-related ICH were often outside of the therapeutic range within the month preceding hemorrhage but more frequently were subtherapeutic. Even with careful avoidance of supratherapeutic INR, vitamin K antagonist use in CAA patients is unlikely to have a major effect in preventing ICH and must be used with caution.",2022,Proceedings (Baylor University. Medical Center),10.1080/08998280.2021.2013393,35261442,https://pubmed.ncbi.nlm.nih.gov/35261442/,35261442,doi:10.1080/08998280.2021.2013393,,false
pubmed:39687922:pubmed_anticoag_refined_20260603T125913_ece52619,pubmed,anticoag_refined,pubmed_anticoag_refined_20260603T125913_ece52619,International normalized ratio measurement during perioperative anticoagulation bridging with low-molecular-weight heparin in patients undergoing heart valve replacement surgery.,"BACKGROUND: Surgical procedures in anticoagulated patients require specific attention due to increased bleeding risk. Preoperative anticoagulation interruption in high-risk patients is often necessary. Bridging anticoagulation with low-molecular-weight heparin (LMWH) minimizes thromboembolic risk, but its effect on international normalized ratio (INR) measurement is not well established, necessitating careful monitoring and individual assessment.
OBJECTIVES: To investigate the effect of heparin bridging on INR measurements in anticoagulated patients on vitamin K antagonist (VKA) and in in vitro spiking experiments.
METHODS: Thirty-eight anticoagulated patients on VKA undergoing valve replacement surgery were studied using 2 plasma-based INR assays and 1 whole blood point-of-care INR method at multiple time points after postoperatively resuming VKA. In addition, INR levels in pooled plasma of both normal and VKA-treated individuals were compared, with 7 spiked concentrations of LMWH or unfractionated heparin (UFH) in 4 INR assays.
RESULTS: In LMWH-bridged anticoagulated patients, the INR results obtained with HemosIL RecombiPlasTin and point-of-care Coaguchek were significantly higher than those obtained with STA Hepato Prest within 3 days after restart of VKA. After spiking LMWH or UFH in various concentrations into pooled plasma, only the STA Hepato Prest assay showed no interference in INR measurement within the therapeutic range (1.0-2.0 international units/mL) in both VKA and normal plasma. All other assays showed substantial interference, with the Thromborel S assay being the most heparin-sensitive assay.
CONCLUSION: Differences between INR methods are seen within 72 hours after restarting VKA in postoperative patients who receive LMWH bridging. In vitro experiments using LMWH and UFH show the interference of heparin in multiple INR methods, even with concentrations below the suppliers' stated heparin interference limits.",2024,Research and practice in thrombosis and haemostasis,10.1016/j.rpth.2024.102616,39687922,https://pubmed.ncbi.nlm.nih.gov/39687922/,39687922,doi:10.1016/j.rpth.2024.102616,,false
pubmed:19476425:pubmed_anticoag_refined_20260603T125913_ece52619,pubmed,anticoag_refined,pubmed_anticoag_refined_20260603T125913_ece52619,Interaction between gemfibrozil and warfarin: case report and review of the literature.,"Possible procoagulant effects can occur when lipid-lowering fibric acid derivatives, such as gemfibrozil and fenofibrate, are taken concomitantly with warfarin. Although there are several detailed reports of fenofibrate potentiating the anticoagulant effects of warfarin, few case reports have been published regarding an interaction between gemfibrozil and warfarin. We describe a 62-year-old man who was taking warfarin for paroxysmal atrial fibrillation and came to the anticoagulation clinic for a routine follow-up. For 9 months, the patient's international normalized ratio (INR) had been stable (target range 2.0-3.0) with warfarin 45 mg/week. At this clinic visit, however, his INR was supratherapeutic at 5.8; the only identified change in his drug therapy was the addition of gemfibrozil 600 mg twice/day, started 3 weeks earlier. The patient denied any changes in his dietary intake of vitamin K, alcohol use, or addition of nonprescription or herbal agents. Recent laboratory tests revealed no signs of thyroid abnormalities and only an insignificant elevation in his alanine aminotransferase level. His warfarin dose was decreased to 35-37.5 mg/week (a 22% reduction), and a therapeutic INR was maintained until gemfibrozil was later discontinued because of myalgia. After consecutive subtherapeutic INRs, his warfarin dose was increased to 45 mg/week and a therapeutic INR was maintained. Use of the Drug Interaction Probability Scale indicated that the likelihood of the gemfibrozil-warfarin interaction was probable. The exact mechanism of the proposed interactions between fibric acid derivatives and warfarin remains unknown but may be multifactorial through inhibition of cytochrome P450 isoenzymes, displacement from protein binding sites, or changes in coagulation factor synthesis. Regardless of the fibric acid derivative chosen, an empiric dosage reduction of 20% and close INR monitoring are warranted in patients receiving warfarin.",2009,Pharmacotherapy,10.1592/phco.29.6.744,19476425,https://pubmed.ncbi.nlm.nih.gov/19476425/,19476425,doi:10.1592/phco.29.6.744,,false
pubmed:37673103:pubmed_anticoag_refined_20260603T125913_ece52619,pubmed,anticoag_refined,pubmed_anticoag_refined_20260603T125913_ece52619,"Effect of Previous INR Control during VKA Therapy on Subsequent DOAC Adherence and Persistence, in Patients Switched from VKA to DOAC.","INTRODUCTION: Current guideline suggests a switch from vitamin K antagonist (VKA) to direct oral anticoagulant (DOAC) in patients with low time in therapeutic range (TTR < 70%). Poor international normalized ratio (INR) control may be the result of poor compliance, and might therefore be associated with subsequent DOAC intake. Therefore, this study evaluates the effect of previous TTR and other measures of INR control on DOAC nonadherence and nonpersistence, in patients who switched from VKA to DOAC.
METHODS: A total of 437 patients who switched from VKA to DOAC between 2012 and 2019 were included using data from Certe Thrombosis Service, IADB.nl pharmacy community database University Groningen, and Statistics Netherlands. DOAC prescriptions were used to determine nonadherence and nonpersistence. INR control (i.e., TTR, time under therapeutic range [TUR], and INR variability) was assessed during the last 180 days of VKA use. Multivariable regression models were applied to determine the association between INR control and DOAC nonpersistence/nonadherence.
RESULTS: On VKA, 67.7% of the patients had a TTR below 70%. DOAC nonpersistence was 39.8% (95% confidence interval [CI]: 33.4-45.5%) during a median follow-up of 34.4 months (interquartile range: 19.1-49.2). Approximately 80% of persistent patients were DOAC-adherent. Low TTR was not associated with DOAC nonpersistence (hazard ratio: 1.14, 95% CI: 0.69-1.87) and DOAC nonadherence (odds ratio: 1.38, 95% CI: 0.67-2.84), nor were TUR and INR variability.
CONCLUSION: Previous INR control during VKA therapy is not associated with subsequent DOAC nonadherence and nonpersistence. This study suggests that INR control on VKA cannot, and therefore should not, be used for predicting DOAC adherence or persistence.",2024,Thrombosis and haemostasis,10.1055/a-2168-9378,37673103,https://pubmed.ncbi.nlm.nih.gov/37673103/,37673103,doi:10.1055/a-2168-9378,,false
pubmed:28515748:pubmed_anticoag_refined_20260603T125913_ece52619,pubmed,anticoag_refined,pubmed_anticoag_refined_20260603T125913_ece52619,Effects of propolis on warfarin efficacy.,"INTRODUCTION: Warfarin is commonly used to avoid thromboembolism, predominantly for cardiovascular pathologies. However, the consumption of several herbal products is not permitted during its use due to the associated interactions. Propolis is a popular phytotherapy product made by honey bees. The use of propolis has been dramatically increasing in recent times.
AIM: To evaluate the possible interactions between propolis and warfarin in a mouse model with determination of the international normalized ratio (INR) values.
MATERIAL AND METHODS: CD-1 mice were employed in the experimental model. The mice were warfarinized, and propolis was administered simultaneously. The INR values were obtained. All animals were sacrificed at the end of the study.
RESULTS: The baseline INR value was 0.8 ±0.1. After 72 h, the INR value increased as expected. The INR value was 7.28 ±1.08 in the control group and 5.8 ±2.88 in the propolis group. At the end of the study, the INR value was 1.3 ±0.37. Propolis interacted with warfarin and caused a decrease in the INR value.
CONCLUSIONS: Propolis interactions, especially with warfarin, should be kept in mind and further studied. Healthcare specialists should be aware of this possible interaction between warfarin and propolis and inform patients about it.",2017,Kardiochirurgia i torakochirurgia polska = Polish journal of cardio-thoracic surgery,10.5114/kitp.2017.66929,28515748,https://pubmed.ncbi.nlm.nih.gov/28515748/,28515748,doi:10.5114/kitp.2017.66929,,false
pubmed:16941417:pubmed_anticoag_refined_20260603T125913_ece52619,pubmed,anticoag_refined,pubmed_anticoag_refined_20260603T125913_ece52619,Dietary vitamin K variability affects International Normalized Ratio (INR) coagulation indices.,"BACKGROUND: Changes in daily vitamin K intake may contribute to marked variations in the International Normalized Ratio (INR) coagulation index in patients receiving oral warfarin anticoagulant therapy, with potentially serious adverse outcomes. Thus, patients receiving warfarin therapy are routinely counseled regarding this drug-nutrient interaction and are instructed to maintain consistent vitamin K intakes, though little quantitative information about this relationship is available.
OBJECTIVE: To determine the quantitative impact of variability in dietary vitamin K(1) (phylloquinone) intake, assessed by a validated patient self-monitoring instrument, on weekly INR in patients receiving warfarin anticoagulant therapy.
METHODS: A prospective dietary assessment study was conducted at the Massachusetts General Hospital in Boston. Sixty outpatients (37 males and 23 females) were selected with a mean age 60.3 +/- 16.8 years, who began oral warfarin anticoagulant therapy within 14 days prior to their first clinic visit to an outpatient anticoagulation therapy unit. Exclusion criteria included more than 2 drinks of alcohol per day, inability to speak English, and concurrent disease states affecting warfarin therapy such as liver disease and terminal illness. Over the five-week study period, participants recorded daily intakes in specified amounts of all food items appearing on a validated dietary self-assessment tool. Concomitant use of prescription and/or non-prescription medications was also obtained. Concurrent daily warfarin dose and adherence to the drug regimen, concomitant use of prescription and/or non-prescription medications known to interact with warfarin, and weekly INR were obtained. Week-to-week changes in vitamin K intake, warfarin dose, and INR were determined and cross-correlated.
RESULTS: Forty-three patients (28 males and 15 females) completed the study and 17 dropped out. Pearson's correlation coefficient revealed the variability in INR and changes in vitamin K intake were inversely correlated (r = -0.600, p < 0.01). Multiple regression analysis (r = 0.848) indicated that a weekly change of 714 mug dietary vitamin K significantly altered weekly INR by 1 unit (p < 0.01) and a weekly change of 14.5 mg warfarin significantly altered weekly INR by 1 unit (p < 0.01) after adjustment for age, sex, weight, height, and concomitant use of medications known to interact with warfarin.
CONCLUSIONS: Patients taking warfarin and consuming markedly changing amounts of vitamin K may have a variable weekly INR with potentially unstable anticoagulant outcomes.",2006,International journal for vitamin and nutrition research. Internationale Zeitschrift fur Vitamin- und Ernahrungsforschung. Journal international de vitaminologie et de nutrition,10.1024/0300-9831.76.2.65,16941417,https://pubmed.ncbi.nlm.nih.gov/16941417/,16941417,doi:10.1024/0300-9831.76.2.65,,false
pubmed:32522446:pubmed_anticoag_refined_20260603T125913_ece52619,pubmed,anticoag_refined,pubmed_anticoag_refined_20260603T125913_ece52619,Anticoagulation resumption after intracranial hemorrhage in patients treated with VKA and DOACs.,"BACKGROUND: Intracranial hemorrhage (ICH) is associated with severe prognosis and recurrent risk. This impacts on the decision to resume anticoagulation in atrial fibrillation (AF) or venous thromboembolism (VTE) patients. Purpose of our study is to evaluate the incidence rate of recurrent ICH in patients with AF or VTE resuming anticoagulation after a first ICH episode.
METHODS: We report data of two cohorts of AF or VTE after a first ICH. The Vitamin K antagonist (VKA) cohort (166 patients) derives from CHIRONE Study, the direct oral anticoagulant (DOAC) cohort (178 patients) derives from START2-Register RESULTS: The clinical characteristics of the two cohort are similar with the exception of more prevalence of history of previous stroke/TIA in DOAC patients with respect to VKA (p = 0.02) and serum creatinine levels>1.5 mg/dL in VKA patients with respect to DOAC(p = 0.0001). The index ICH was spontaneous in 66.4% and in 33.7% among DOAC and VKAs cohort respectively (p = 0.0001). During follow-up, 14 recurrent ICH were recorded; 9 (rate 2.5 × 100 patient-years) in VKA and 5 (rate 1.3 × 100 patient-years) in DOAC (Relative Risk 1.9; 95% CI 0.6-7.4; p = 0.2). The univariate logistic regression analysis showed that patients with recurrent ICH were more frequently males, hypertensive, with a history of previous Stroke/TIA and older than patients without recurrence. VKA patients showed a higher risk of recurrence with respect to DOAC patients (OR 1.9;95% CI 0.7-6.7).
CONCLUSIONS: A trend toward fewer ICH recurrences was detected among DOACs patients in comparison to the previously reported rate of patients on warfarin.",2020,European journal of internal medicine,10.1016/j.ejim.2020.05.020,32522446,https://pubmed.ncbi.nlm.nih.gov/32522446/,32522446,doi:10.1016/j.ejim.2020.05.020,,false
pubmed:37313284:pubmed_anticoag_refined_20260603T125913_ece52619,pubmed,anticoag_refined,pubmed_anticoag_refined_20260603T125913_ece52619,A Case of Symptomatic Supratherapeutic International Normalized Ratio on Rivaroxaban.,"Rivaroxaban is a direct oral anticoagulant that works by inhibiting factor Xa. Direct anticoagulants have largely replaced direct vitamin K inhibitors (VKAs) due to the decreased risk of major hemorrhages and the lack of need for regular monitoring and dose adjustments. However, there have been multiple reports of elevated international normalized ratio (INR) and bleeding incidents in patients on rivaroxaban, which brings into question the potential need for monitoring. We report a case of an INR of 4.8 in a rivaroxaban-naïve patient who presented with gastrointestinal bleeding and a significant drop in hemoglobin four days after starting rivaroxaban. We present possible pharmacologic explanations. We propose the idea that specific subgroups of patients may be at risk for true INR elevations and may benefit from routine monitoring of their INR while on rivaroxaban.",2023,Cureus,10.7759/cureus.40282,37313284,https://pubmed.ncbi.nlm.nih.gov/37313284/,37313284,doi:10.7759/cureus.40282,,false
pubmed:39491548:pubmed_anticoag_refined_20260603T125913_ece52619,pubmed,anticoag_refined,pubmed_anticoag_refined_20260603T125913_ece52619,Transitioning between therapeutic anticoagulants: a clinicians guide to switching patients to or from DOAC therapy.,"INTRODUCTION: The transition to or from direct oral anticoagulants (DOACs) is common in clinical practice.
AREAS COVERED: A literature search was conducted on PubMed, Google Scholar, and UpToDate up to March 2024 for conditions and approaches for transitioning from one agent to the other. No randomized clinical trials were retrieved except for two studies regarding switching to DOAC in well-conducted vitamin K antagonist (VKA) therapy. A narrative review was conducted addressing the conditions for switching from one agent to the other, such as thromboembolic events and major bleeding during anticoagulation, development or worsening of kidney or liver failure, initiation of interfering drugs, adverse events such as allergic reactions, frailty, patients' preferences, and affordability. During transitions from one anticoagulant to the other, the risk of both thromboembolic and bleeding complications should be minimized. The current approaches for such transitions are derived from those employed in clinical trials evaluating DOAC and from product information.
EXPERT OPINION: Many uncertainties remain regarding those circumstances requiring a change in anticoagulant strategies, as they lack evidence-based guidance. It can be envisaged that the problem of switching to and from DOAC will need additional studies especially addressing the conditions and the best approach to such transitions.",2024,Expert review of cardiovascular therapy,10.1080/14779072.2024.2421800,39491548,https://pubmed.ncbi.nlm.nih.gov/39491548/,39491548,doi:10.1080/14779072.2024.2421800,,false
pubmed:27354859:pubmed_anticoag_refined_20260603T125913_ece52619,pubmed,anticoag_refined,pubmed_anticoag_refined_20260603T125913_ece52619,Management of antithrombotic therapy during cardiac implantable device surgery.,"Anticoagulants are commonly used drugs that are frequently encountered during device placement. Deciding when to halt or continue the use of anticoagulants is a balance between the risks of thromboembolism versus bleeding. Patients taking warfarin with a high risk of thromboembolism should continue to take their warfarin without interruption during device placement while ensuring their international normalized ratio remains below 3. For patients who are taking warfarin and have low risk of thromboembolism, either interrupted or continued warfarin may be used, with no evidence to clearly support either strategy. There is little evidence to support continuing direct acting oral anticoagulants (DOACs) for device implantation. The timing of halting these medications depends largely on renal function. If bleeding occurs, warfarin׳s anticoagulation effect is reversible with vitamin K and activated prothrombin complex concentrate. There are no DOAC reversal agents currently available, but some are under development. Regarding antiplatelet agents, aspirin alone can be safely continued while clopidogrel alone may also be continued, but with a slightly higher bleeding risk. Dual antiplatelet therapy for bare-metal stent/drug-eluting stent implanted within 4 weeks/6 months, respectively, should be continued due to high risk of stent thrombosis; however, if they are implanted after this period, then clopidogrel can be halted 5 days before the procedure and resumed soon after, while aspirin is continued. If the patient is taking both aspirin and warfarin, aspirin should be halted 5 days prior to the procedure, while warfarin is continued.",2016,Journal of arrhythmia,10.1016/j.joa.2015.12.003,27354859,https://pubmed.ncbi.nlm.nih.gov/27354859/,27354859,doi:10.1016/j.joa.2015.12.003,,false
pubmed:16305294:pubmed_anticoag_refined_20260603T125913_ece52619,pubmed,anticoag_refined,pubmed_anticoag_refined_20260603T125913_ece52619,Low-dose vitamin K to augment anticoagulation control.,"STUDY OBJECTIVES: To determine the effect of daily low-dose oral vitamin K supplementation on reducing variations in the international normalized ratios (INRs) in patients taking warfarin.
DESIGN: Retrospective analysis.
SETTING: Anticoagulation clinic in a large, private-practice hematology group.
PATIENTS: Eight motivated patients (three men, five women), aged 45-79 years, receiving anticoagulant therapy with warfarin, whose INRs had been fluctuating for reasons not associated with identifiable changes in diet, warfarin dosage, activity level, illness, or changes in drug therapy.
INTERVENTION: Daily supplementation with oral vitamin K, starting with 100 microg/day
MEASUREMENTS AND MAIN RESULTS: Anticoagulation providers monitored INR responses; all documented INR values were included in the analysis, even those intentionally allowed outside the therapeutic range when dosages were adjusted for procedures. After dietary vitamin K supplementation, INR fluctuations diminished in nearly all patients. Overall, a significant decrease was noted in the INR standard deviation (p<0.05), and more INRs were in the therapeutic range after the start of supplementation. Allowing for small fluctuations on either side of the target range, the number of INRs within 0.2 units of the target range increased from 32% to 57% (relative increase 76%). Time in range also increased by a similar degree.
CONCLUSION: Supplementation with daily low-dose oral vitamin K significantly increased the number of INRs in range as well as the time in range, and decreased INR fluctuation in this small series of selected patients.",2005,Pharmacotherapy,10.1592/phco.2005.25.12.1746,16305294,https://pubmed.ncbi.nlm.nih.gov/16305294/,16305294,doi:10.1592/phco.2005.25.12.1746,,false
pubmed:23545828:pubmed_anticoag_refined_20260603T125913_ece52619,pubmed,anticoag_refined,pubmed_anticoag_refined_20260603T125913_ece52619,[Diagnosis and treatment of warfarin resistance].,"Warfarin resistance is a phenomenon that patients need to take much higher than normally prescribed dosage of warfarin to maintain the target therapeutic international normalized ratio (INR) range, or even fail to reach the target INR. Warfarin resistance can be categorized in etiologic terms as hereditary vs acquired, or in pharmacologic terms as pharmacokinetic vs pharmacodynamic. Once warfarin resistance is diagnosed, the type of resistance should be determined as soon as possible so that treatment could be oriented toward the causes. Poor compliance, genetic mutations, concurrent medications that could decrease the absorption or increase the clearance of warfarin, and consumption of diet rich in vitamin K are the major reasons for warfarin resistance. Educating patients, increasing warfarin dosage and switching to other anticoagulants would be effective for warfarin resistance.",2013,Zhong nan da xue xue bao. Yi xue ban = Journal of Central South University. Medical sciences,10.3969/j.issn.1672-7347.2013.03.016,23545828,https://pubmed.ncbi.nlm.nih.gov/23545828/,23545828,doi:10.3969/j.issn.1672-7347.2013.03.016,,false
