record_id,source,target_id,search_run_id,title,abstract_or_summary,year,journal_or_source,doi,pmid,url,raw_record_id,dedup_key,duplicate_of,is_duplicate
pubmed:39836479:pubmed_kidney_stone_refined_20260603T125918_598b32ee,pubmed,kidney_stone_refined,pubmed_kidney_stone_refined_20260603T125918_598b32ee,Calcium-Sensing Receptor in the Thick Ascending Limb and Renal Response to Hypercalcemia.,"KEY POINTS: The thick ascending limb (TAL) calcium-sensing receptor (CaSR) was critical for controlling calcium excretion in response to hypercalcemia but did not alter urinary magnesium excretion. CaSR activation increased urinary calcium excretion by strongly reducing calcium permeability in the TAL. Activation of the CaSR did not affect the driving force generated by transcellular NaCl transport across the TAL.
BACKGROUND: The parathyroid calcium-sensing receptor (CaSR) controls the release of parathyroid hormone in response to changes in serum calcium levels. Activation of the renal CaSR increases urinary calcium excretion and is particularly important when CaSR-dependent reductions in parathyroid hormone fail to lower serum calcium. However, the role of the renal CaSR in protecting against hypercalcemia and the direct effects of chronic CaSR activation on tubular calcium handling remain to be fully elucidated.
METHODS: Experimental hypercalcemia was induced using a vitamin D analog (dihydrotachysterol) in mice with Ksp-Cre–dependent deletion of the Casr (Ksp-Casr) in the kidney, with Cre-negative littermates serving as controls (here denoted wild-types [WT]). Urinary and fecal electrolyte determinations, dual-energy x-ray absorptiometry, molecular and biochemical evaluation, and in vitro tubule microperfusion were performed in both sexes.
RESULTS: Ksp-Cre–driven Casr deletion strongly reduced CaSR abundance in the thick ascending limb (TAL). At baseline, no marked differences were detected in electrolyte handling and tubular permeability characteristics across the TAL. Three days of dihydrotachysterol administration induced hypercalcemia in both WT and Ksp-Casr mice. However, although WT mice developed hypercalciuria, this response was absent in Ksp-Casr mice. Urinary excretion of magnesium and other electrolytes did not differ between hypercalcemic WT and Ksp-Casr mice. Intestinal electrolyte absorption was comparable between the two groups. Microperfusion of isolated cortical TALs revealed no baseline differences in transepithelial voltage, resistance, or ion permeabilities. After hypercalcemia, transepithelial resistance increased and calcium permeability markedly decreased in WT mice, but not in Ksp-Casr mice, with only minor alterations in magnesium permeability and no changes in transepithelial voltage.
CONCLUSIONS: In hypercalcemic mice, the absence of the CaSR in TAL prevented the increase in urinary calcium excretion. The CaSR specifically regulated the paracellular permeability of the TAL, especially for calcium.",2025,Journal of the American Society of Nephrology : JASN,10.1681/ASN.0000000612,39836479,https://pubmed.ncbi.nlm.nih.gov/39836479/,39836479,doi:10.1681/asn.0000000612,,false
pubmed:8620732:pubmed_kidney_stone_refined_20260603T125918_598b32ee,pubmed,kidney_stone_refined,pubmed_kidney_stone_refined_20260603T125918_598b32ee,"Vitamin D, calcium, and sarcoidosis.","Hypercalcemia occurs in about 10% of the patients with sarcoidosis; hypercalciuria is about three times more frequent. These abnormalities of calcium metabolism are due to dysregulated production of 1,25-(OH)2-D3 (calcitriol) by activated macrophages trapped in pulmonary alveoli and granulomatous inflammation. Undetected hypercalcemia and hypercalciuria can cause nephrocalcinosis, renal stones, and renal failure. Corticosteroids cause prompt reversal of the metabolic defect. Chloroquine, hydroxychloroqune, and ketoconazole are the drugs that should be used if the patient fails to respond or develops dangerous side effects to corticosteroid therapy.",1996,Chest,10.1378/chest.109.2.535,8620732,https://pubmed.ncbi.nlm.nih.gov/8620732/,8620732,doi:10.1378/chest.109.2.535,,false
pubmed:37761859:pubmed_kidney_stone_refined_20260603T125918_598b32ee,pubmed,kidney_stone_refined,pubmed_kidney_stone_refined_20260603T125918_598b32ee,"Oxalate (dys)Metabolism: Person-to-Person Variability, Kidney and Cardiometabolic Toxicity.","Oxalate is a metabolic end-product whose systemic concentrations are highly variable among individuals. Genetic (primary hyperoxaluria) and non-genetic (e.g., diet, microbiota, renal and metabolic disease) reasons underlie elevated plasma concentrations and tissue accumulation of oxalate, which is toxic to the body. A classic example is the triad of primary hyperoxaluria, nephrolithiasis, and kidney injury. Lessons learned from this example suggest further investigation of other putative factors associated with oxalate dysmetabolism, namely the identification of precursors (glyoxylate, aromatic amino acids, glyoxal and vitamin C), the regulation of the endogenous pathways that produce oxalate, or the microbiota's contribution to oxalate systemic availability. The association between secondary nephrolithiasis and cardiovascular and metabolic diseases (hypertension, type 2 diabetes, and obesity) inspired the authors to perform this comprehensive review about oxalate dysmetabolism and its relation to cardiometabolic toxicity. This perspective may offer something substantial that helps advance understanding of effective management and draws attention to the novel class of treatments available in clinical practice.",2023,Genes,10.3390/genes14091719,37761859,https://pubmed.ncbi.nlm.nih.gov/37761859/,37761859,doi:10.3390/genes14091719,,false
pubmed:36645022:pubmed_kidney_stone_refined_20260603T125918_598b32ee,pubmed,kidney_stone_refined,pubmed_kidney_stone_refined_20260603T125918_598b32ee,Ionized hypercalcemia in 238 cats from a referral hospital population (2009-2019).,"BACKGROUND: Ionized calcium concentration ([iCa]) is more sensitive for detecting calcium disturbances than serum total calcium concentration but literature on ionized hypercalcemia in cats is limited. Urolithiasis is a possible adverse consequence of hypercalcemia.
HYPOTHESIS/OBJECTIVES: To describe clinical details of diagnoses associated with ionized hypercalcemia in cats and association with urolithiasis.
ANIMALS: Cats (238) seen between 2009 and 2019 at a referral hospital with [iCa] above the normal reference interval.
METHODS: Observational cross-sectional study. Signalment, serum biochemical and imaging findings were reviewed for cats with ionized hypercalcemia considered to be clinically relevant (>1.41 mmol/L). Data were summarized by cause of hypercalcemia (i.e., diagnosis).
RESULTS: Diagnoses for the 238 cats with [iCa] >1.41 mmol/L included: acute kidney injury (AKI; 13%), malignancy-associated (10.1%), idiopathic hypercalcemia (IHC; 10.1%), chronic kidney disease/renal diet-associated (8.4%), iatrogenic (5.5%), primary hyperparathyroidism (2.1%), vitamin D toxicity (2.1%) and granulomatous disease (1.7%). In 112 cases (47.1%), no cause for ionized hypercalcemia could be determined (n = 95), hypercalcemia was transient (n = 12), or the cat was juvenile (<1 year; n = 5). Urolithiasis was identified in 83.3% of AKI, 72.7% of iatrogenic, 61.1% of CKD/renal diet-associated and 50% of IHC cases that were imaged (<50% for other diagnoses). Diagnoses with a high proportion of concurrent total hypercalcemia included primary hyperparathyroidism (100%), vitamin D toxicity (100%), malignancy-associated (71.4%), granulomatous disease (66.7%) and IHC (65.2%).
CONCLUSIONS AND CLINICAL IMPORTANCE: Ionized hypercalcemia was most commonly associated with kidney diseases, neoplasia or IHC. The proportion of urolithiasis cases varied by diagnosis.",2023,Journal of veterinary internal medicine,10.1111/jvim.16627,36645022,https://pubmed.ncbi.nlm.nih.gov/36645022/,36645022,doi:10.1111/jvim.16627,,false
pubmed:35598638:pubmed_kidney_stone_refined_20260603T125918_598b32ee,pubmed,kidney_stone_refined,pubmed_kidney_stone_refined_20260603T125918_598b32ee,Calcium homeostasis and hyperparathyroidism: Nephrologic and endocrinologic points of view.,"Parathyroid hormone (PTH) is a hypercalcemic hormone acting on kidneys, bone and intestine. PTH promotes calcium release from the bone, renal calcium reabsorption and phosphate excretion, and conversion of 25-hydroxyvitamin D to 1,25-dihydroxyvitamin D-3. Hyperparathyroidism consists in PTH elevation, which may be adapted (secondary hyperparathyroidism) or non-adapted to calcemia levels (primary hyperparathyroidism, familial hypercalcemia/hypocalciuria, tertiary hyperparathyroidism). Primary hyperparathyroidism (PHP) features hypercalcemia and elevated or inappropriate PTH elevation. PHP may be revealed by biological abnormalities such as hypercalcemia and can be accompanied by renal complications (hypercalciuria, nephrolithiasis, nephrocalcinosis) and/or osteoporosis. However, it can also be normocalcemic and calcium loading will be necessary to diagnosis it. The differential diagnosis of PHP is familial hypocalciuric hypercalcemia (FHH), a dominant autosomal disease implicating a calcium sensing receptor-inactivating mutation. It impairs parathyroid cell sensitivity to calcemia elevation and thus induces excessive PTH stimulation, leading to hypercalcemia. Secondary HP (SHP) consists in PTH elevation secondary to a stimulus that needs to be corrected. 25 OHvitD deficiency, kidney failure, renal hypercalciuria, malabsorption and some drugs can induce SHP. Tertiary HP (THP) consists in autonomous PTH secretion by the parathyroid glands after prolonged stimulation under SHP, of whatever cause. This parathyroid autonomy results from the polyclonal hyperplasia observed in SHP progressing toward monoclonal nodular proliferation, leading to nodular hyperplasia or parathyroid adenoma (or, exceptionally, carcinoma), with reduced expression of CaSR and vitamin D receptor. In patients under dialysis, the frontier between SHP and THP is a matter of debate. This review will focus on the pathophysiology of calcium, diagnosis, and management of hyperparathyroidism.",2022,Annales d'endocrinologie,10.1016/j.ando.2022.05.003,35598638,https://pubmed.ncbi.nlm.nih.gov/35598638/,35598638,doi:10.1016/j.ando.2022.05.003,,false
pubmed:37049567:pubmed_kidney_stone_refined_20260603T125918_598b32ee,pubmed,kidney_stone_refined,pubmed_kidney_stone_refined_20260603T125918_598b32ee,Vitamin D and Calcium Supplementation and Urolithiasis: A Controversial and Multifaceted Relationship.,"Patients with urolithiasis, and particularly those with hypercalciuria, frequently have a marked reduction of bone mineral content up to the levels of osteoporosis, with a significant increase in bone fracture risk. For these reasons, the indication to prescribe vitamin D and/or calcium supplementations is very frequent in such patients. On the other hand, both calcium supplementation, and even more vitamin D therapy, can worsen the risk of developing urolithiasis by increasing calcium, phosphate, and oxalate urinary excretion. Despite the clinical and practical relevance of this issue, the evidence on this topic is scarce and contradictory. Therefore, some concerns exist about how and whether to prescribe such supplements to a patient with a history of kidney stones. In this narrative review, we resume some pivotal pathophysiological concepts strictly related to the dealt topic, and we draw some considerations and personal opinions on the pros and cons of such prescriptions. Finally, we share with the reader our pragmatic algorithm for handling the urolithiasis risk in patients who have strong indications to be prescribed vitamin D and calcium supplementations.",2023,Nutrients,10.3390/nu15071724,37049567,https://pubmed.ncbi.nlm.nih.gov/37049567/,37049567,doi:10.3390/nu15071724,,false
pubmed:26816771:pubmed_kidney_stone_refined_20260603T125918_598b32ee,pubmed,kidney_stone_refined,pubmed_kidney_stone_refined_20260603T125918_598b32ee,Calcium intake and urinary stone disease.,"Calcium homeostasis is a complicated and incompletely understood process that is primarily regulated through an interaction between the intestines, kidneys, and bones. Intestinal calcium absorption is determined by many factors including the amount of regular calcium intake, as well as vitamin D and parathyroid hormone levels. Intestinal calcium absorption is likely different between stone formers and non-stone formers, with higher levels of calcium absorption in those with a history of stones independent of their calcium intake. We no longer recommend dietary calcium restriction as this may lead to bone demineralization and an increase in stone formation. Practitioners need to continue to educate patients to maintain moderate dietary calcium intake. The effect of calcium supplementation on stone formation is currently controversial. It is likely that large doses of supplemental calcium, especially if taken separate from a meal, may lead to stone formation. When necessary, stone forming patients should be encouraged to take their calcium supplements with a meal and their stone disease should be monitored.",2014,Translational andrology and urology,10.3978/j.issn.2223-4683.2014.06.05,26816771,https://pubmed.ncbi.nlm.nih.gov/26816771/,26816771,doi:10.3978/j.issn.2223-4683.2014.06.05,,false
pubmed:16775455:pubmed_kidney_stone_refined_20260603T125918_598b32ee,pubmed,kidney_stone_refined,pubmed_kidney_stone_refined_20260603T125918_598b32ee,Genetic hypercalciuric stone-forming rats.,"PURPOSE OF REVIEW: We will describe the pathophysiology of hypercalciuria and the mechanism of the resultant stone formation in a rat model and draw parallels to human hypercalciuria and stone formation.
RECENT FINDINGS: Through inbreeding we have established a strain of rats that excrete 8-10 times more urinary calcium than control rats. These genetic hypercalciuric rats absorb more dietary calcium at lower 1,25-dihydroxyvitamin D3 levels. Elevated urinary calcium excretion on a low-calcium diet indicated a defect in renal calcium reabsorption and/or an increase in bone resorption. Bone from hypercalciuric rats released more calcium when exposed to 1,25-dihydroxyvitamin D3. Bisphosphonate significantly reduced urinary calcium excretion in rats fed a low-calcium diet. Clearance studies showed a primary defect in renal calcium reabsorption. The intestine, bone and kidneys of the hypercalciuric rats had increased numbers of vitamin D receptors. When hydroxyproline is added to their diet they form calcium oxalate stones, the most common stone type in humans. Increased numbers of vitamin D receptors may cause hypercalciuria in these rats and humans.
SUMMARY: Understanding the mechanism of hypercalciuria and stone formation in this animal model will help clinicians devise effective treatment strategies for preventing recurrent stone formation in humans.",2006,Current opinion in nephrology and hypertension,10.1097/01.mnh.0000232881.35469.a9,16775455,https://pubmed.ncbi.nlm.nih.gov/16775455/,16775455,doi:10.1097/01.mnh.0000232881.35469.a9,,false
pubmed:29664757:pubmed_kidney_stone_refined_20260603T125918_598b32ee,pubmed,kidney_stone_refined,pubmed_kidney_stone_refined_20260603T125918_598b32ee,Primary hyperparathyroidism: recent advances.,"PURPOSE OF REVIEW: The purpose of this review is to describe recent advances and changes in the evaluation and management of primary hyperparathyroidism (PHPT).
RECENT FINDINGS: Although it has long been recognized that asymptomatic PHPT is associated with bone loss, particularly at cortical skeletal sites when evaluated with dual-energy X-ray absorptiometry, new imaging techniques suggest that trabecular skeletal deterioration as well as clinically silent vertebral fractures and nephrolithiasis are common. Nonclassical targets of asymptomatic PHPT as well as the effect of vitamin D deficiency and treatment upon PHPT presentation have been the subject of recent intense investigation. Randomized clinical trials are now available regarding the effect of parathyroidectomy (PTX) upon both classical and nonclassical target organs. They have confirmed results from observational studies with regard to the skeletal benefits of PTX but have not consistently shown improvements in nonclassical symptoms.
SUMMARY: These findings have led to recommendations for more extensive renal and skeletal evaluation and broader criteria for PTX in PHPT. In addition to dual-energy X-ray absorptiometry, vertebral and renal imaging is recommended. When available, trabecular imaging techniques may be helpful. PTX criteria now include subclinical kidney stones, vertebral fractures and hypercalciuria, in addition to those based on age, serum calcium, bone densitometry and renal function.",2018,Current opinion in rheumatology,10.1097/BOR.0000000000000511,29664757,https://pubmed.ncbi.nlm.nih.gov/29664757/,29664757,doi:10.1097/bor.0000000000000511,,false
pubmed:29376607:pubmed_kidney_stone_refined_20260603T125918_598b32ee,pubmed,kidney_stone_refined,pubmed_kidney_stone_refined_20260603T125918_598b32ee,[Idiopathic hypercalciuria. Diagnosis and treatment].,"Most patients with idiopathic hypercalciuria and calcium nephrolithiasis have a family history of the disease. Idiopathic hypercalciuria is a metabolic abnormality with various causes and developmental pathways. The systematic review describes specific mutations associated with idiopathic hypercalciuria and nephrolithiasis. Detection of these mutations may provide a better understanding of the pathogenesis of this heterogeneous disease and personalize patient management depending on the detected polymorphisms. A promising treatment option for a mutation in the vitamin D receptor gene is thiazide diuretics in combination with bisphosphonates. Among bisphosphonates, the drug of choice which has been most strongly supported by research evidence is alendronate.",2017,"Urologiia (Moscow, Russia : 1999)",,29376607,https://pubmed.ncbi.nlm.nih.gov/29376607/,29376607,pmid:29376607,,false
pubmed:40551736:pubmed_kidney_stone_refined_20260603T125918_598b32ee,pubmed,kidney_stone_refined,pubmed_kidney_stone_refined_20260603T125918_598b32ee,"Cholecalciferol (vitamin D3): efficacy, safety, and implications in public health.","Vitamin D₃ (cholecalciferol) is a fat-soluble secosteroid with essential roles in calcium-phosphorus metabolism, bone health, and an expanding range of extraskeletal processes. Upon synthesis in the skin via ultraviolet B exposure or ingestion from dietary sources, cholecalciferol is hydroxylated in the liver and kidneys to form its active metabolite, calcitriol (1,25-dihydroxyvitamin D), which exerts pleiotropic effects through vitamin D receptor (VDR)-mediated genomic and non-genomic pathways. This narrative review synthesizes evidence on the systemic effects of high-dose cholecalciferol on bone health, metabolism, cardiovascular and immune function, and its emerging roles in neurological, gastrointestinal, reproductive, oncologic, and psychiatric disorders. High-dose vitamin D₃ has demonstrated benefits in specific populations, including improved bone mineral density, immune homeostasis, glycemic control, and reduced inflammation. In patients with chronic kidney disease, cystic fibrosis, and inflammatory bowel disease, targeted supplementation has been associated with clinical improvements. Preclinical models support calcitriol's antiproliferative and neuroprotective functions, and its synergistic effects with chemotherapy, although large-scale randomized controlled trials (RCTs) have yielded mixed or inconclusive results, particularly in cancer, cardiovascular events, and cognitive decline. Methodological variability-such as inconsistent dosing regimens, baseline vitamin D status, and heterogeneous populations-limits definitive conclusions. While vitamin D supplementation is generally safe within recommended limits, excessive intake may cause hypercalcemia or nephrolithiasis, emphasizing the need for personalized strategies. Food fortification and targeted screening remain underutilized yet cost-effective public health interventions. Overall, vitamin D₃ represents a promising but complex therapeutic agent, necessitating further rigorously designed clinical trials to establish evidence-based guidelines for its use in diverse pathological conditions.",2025,Frontiers in nutrition,10.3389/fnut.2025.1579957,40551736,https://pubmed.ncbi.nlm.nih.gov/40551736/,40551736,doi:10.3389/fnut.2025.1579957,,false
pubmed:41258546:pubmed_kidney_stone_refined_20260603T125918_598b32ee,pubmed,kidney_stone_refined,pubmed_kidney_stone_refined_20260603T125918_598b32ee,The Role of Diet in Kidney Stone Pathogenesis and Prevention.,"PURPOSE OF REVIEW: The origin of kidney stones is multifactorial, involving a complex interplay of genetic, metabolic, and environmental factors. This review aims to detail the relationship between the molecular pathogenesis of kidney stone disease and the impact diet can have on stone formation and patient outcomes.
RECENT FINDINGS: Diet is an important part of managing kidney stones at a molecular level. Oxalate can be absorbed from the diet through the digestive system into the urine where calcium and oxalate can combine to form stones. Evidence supports that low dietary calcium contributes to first time and recurrent stones, and high dietary sodium elevates the risk of calcium stone formation. Diets high in animal protein cause high levels of urinary uric acid and calcium and low levels of urinary citrate. Low urine pH favors uric acid stone development, and fructose increases serum and urinary uric acid levels. Alternatively, consuming fruits and vegetables raises urinary pH and citrate excretion. Adequate hydration also dilutes urinary solutes and reduces supersaturation. Potassium citrate, magnesium, and calcium supplementation are thought to prevent stone formation. Diet and adequate hydration can manipulate the pathogenesis of stones to prevent recurrence and improve patient outcomes. Calcium oxalate stones are the most common, followed by calcium phosphate, uric acid, struvite, and cystine stones. By aligning nutritional interventions with stone type and metabolic profile, healthcare providers can offer non-invasive methods for improving outcomes.",2025,Current urology reports,10.1007/s11934-025-01304-1,41258546,https://pubmed.ncbi.nlm.nih.gov/41258546/,41258546,doi:10.1007/s11934-025-01304-1,,false
pubmed:34857184:pubmed_kidney_stone_refined_20260603T125918_598b32ee,pubmed,kidney_stone_refined,pubmed_kidney_stone_refined_20260603T125918_598b32ee,Safety and effectiveness of vitamin D mega-dose: A systematic review.,"INTRODUCTION: Supplementation with high doses of vitamin D, known as mega-dose or ""stoss therapy,"" refers to administering high doses of vitamin D by oral or intramuscular route in short periods of time. In this sense, conducting a review to organize this knowledge in a single article will generate a helpful instrument for researchers working in this area and for health professionals who use this therapeutic tool.
OBJECTIVE: To carry out a literature review on safety and efficacy (normalization of serum vitamin D level, and changes in the clinical picture) of vitamin D mega-dose use.
METHODOLOGY: This is a systematic review of the literature searching data through the electronic banks of PubMed, Scielo, and LILACS, using the following keywords: ""vitamin D,"" ""mega-dose,"" ""stoss therapy,"" ""cholecalciferol,"" in different combinations. CONSORT questionnaire was used to assess the quality of the included studies.
RESULTS: Of the 59 articles screened for this review, 10 were included in the review, studying patients with rickets, osteoporosis, and critically ill patients. Two studies compared the exact dosage of vitamin D by different routes of administration, and three studies compared different doses by the same route. All others studied vitamin D mega-dose versus placebo. Adverse effects were observed through the presence of hypercalcemia/hypercalciuria. Serum vitamin D levels were normalized between 70 and 100% of patients, and adverse effects ranged between 1.9 and 18.5%.
CONCLUSION: The study demonstrated that vitamin D mega-dose therapy is effective in normalizing serum vitamin levels, and the toxicity assessed through adverse effects was low, with no expressive clinical significance. Despite this, there is still a need for further studies in the area to confirm the results found.",2021,Clinical nutrition ESPEN,10.1016/j.clnesp.2021.09.010,34857184,https://pubmed.ncbi.nlm.nih.gov/34857184/,34857184,doi:10.1016/j.clnesp.2021.09.010,,false
pubmed:223811:pubmed_kidney_stone_refined_20260603T125918_598b32ee,pubmed,kidney_stone_refined,pubmed_kidney_stone_refined_20260603T125918_598b32ee,Cadmium nephropathy.,"Cadmium is an inessential trace metal which accumulates in human tissues from contamination of food, water or air. The kidney is the critical organ following long-term, low-level absorption either by inhalation or ingestion; accumulation occurring in tubular epithelium in the form of a cadmium-metallothionein complex, giving rise to tubular dysfunction. In a group of 12 cadmium workers some of whom were followed for up to 16 years, tubular proteinuria, renal glycosuria, aminoaciduria, hypercalciuria and defects of concentration and acidification have been observed. Two men became recurrent renal stone formers and 1 man, who had nephrocalcinosis when first seen, later developed vitamin D-resistant osteomalacia. Renal tubular dysfunction following cadmium exposure may continue symptom-free for long intervals, but in a proportion of cases serious clinical effects may eventually develop.",1979,Contributions to nephrology,10.1159/000402891,223811,https://pubmed.ncbi.nlm.nih.gov/223811/,223811,doi:10.1159/000402891,,false
